{
  "schema_version": 1,
  "projection": "sankey",
  "metadata": {
    "generated_by": "testdata/sankey.golden.json (hand-derived, Wave 0)",
    "fiscal_year": 2026,
    "fiscal_year_label": "FY 2025-26",
    "basis": "adopted",
    "scopes": [
      "all-funds-gross"
    ],
    "currency": "USD",
    "units": "cents",
    "sources": [
      {
        "doc_id": "livermore-budget-fy2026-2027",
        "pages": [
          66,
          67
        ]
      }
    ],
    "headline": {
      "all_funds_gross_revenue_cents": 29996900700,
      "all_funds_gross_expenditure_cents": 25409541200,
      "external_revenue_cents": 28099917300,
      "external_expenditure_cents": 22901804500,
      "internal_transfer_in_cents": 2152599700,
      "internal_transfer_out_cents": 5961273400,
      "naive_expenditure_cents": 31370814600,
      "transfer_residual_cents": 3808673700
    },
    "counts": {
      "facts": 120,
      "facts_cited": 58,
      "facts_uncited": 62,
      "facts_cited_twice": 0,
      "nodes": 25,
      "links": 58
    },
    "caveats": [
      {
        "id": "transfer-legs-unpaired",
        "summary": "Transfers in and transfers out are two separate totals here, and they need not match.",
        "text": "This chart draws the money the city's funds move to one another as two totals, Transfers In and Transfers Out, without pairing each payment with its receipt; Transfers In opens into Budget Book p76's fund-by-fund list. Transfers out ($59,612,734) exceed transfers in ($21,525,997) by $38,086,737. The difference is what the operating funds send to capital projects, the Capital Improvement Program, which Budget Book p222 lists fund by fund; those capital funds are not on this chart.",
        "theme": "left-out",
        "applies_to": [
          "transfers/in",
          "transfers/out"
        ]
      },
      {
        "id": "internal-service-is-outside-the-external-headline",
        "summary": "Charges one city department bills another are left out of the headline totals.",
        "text": "Internal Service Funds charge other city departments for things like vehicles and computers. That is the city paying itself, so the headline leaves it out. The all-funds totals include it, and match the city's own citywide totals.",
        "theme": "left-out",
        "applies_to": [
          "fund-group/internal-service"
        ]
      },
      {
        "id": "working-capital-is-a-stock",
        "summary": "The money funds hold at the start and end of the year is not drawn, only what moves.",
        "text": "Budget Book pp.66-67 print each fund group's beginning and ending working capital. Those are amounts on hand, not money moving, so the chart draws no ribbon for them, and its columns will not add up row for row to that page.",
        "theme": "left-out",
        "applies_to": []
      },
      {
        "id": "permanent-funds-have-no-column",
        "summary": "The city's two Permanent Funds have no column on this page, so they are not drawn.",
        "text": "The city has a seventh kind of fund, Permanent Funds (2 funds), and Budget Book pp.66-67 print no column for them.",
        "theme": "left-out",
        "applies_to": []
      }
    ]
  },
  "nodes": [
    {
      "id": "fund-balance/draw",
      "label": "Fund Balance Draw",
      "tier": 0,
      "parent": "",
      "constraint_tier": "",
      "role": "fund_balance_draw",
      "derived": true,
      "rationale": "Our sign-decomposition of a published change in balance: a negative change is a draw on accumulated balance. The city prints a fund group's change as one signed row, and a fund's as the beginning and ending balances it is the difference of; a Sankey cannot render a negative link.",
      "source_note": "Budget Book PDF pp.66-67, CHANGE IN WORKING CAPITAL; pp.186-209, each fund's beginning and ending balance"
    },
    {
      "id": "revenue/charges-for-services",
      "label": "Charges for Services",
      "tier": 0,
      "parent": "",
      "constraint_tier": "",
      "role": "revenue_source",
      "derived": false,
      "rationale": "",
      "source_note": ""
    },
    {
      "id": "revenue/contributions-outsourced",
      "label": "Contributions Outsourced",
      "tier": 0,
      "parent": "",
      "constraint_tier": "",
      "role": "revenue_source",
      "derived": false,
      "rationale": "",
      "source_note": ""
    },
    {
      "id": "revenue/fines-and-forfeitures",
      "label": "Fines & Forfeitures",
      "tier": 0,
      "parent": "",
      "constraint_tier": "",
      "role": "revenue_source",
      "derived": false,
      "rationale": "",
      "source_note": ""
    },
    {
      "id": "revenue/intergovernmental",
      "label": "Intergovernmental",
      "tier": 0,
      "parent": "",
      "constraint_tier": "",
      "role": "revenue_source",
      "derived": false,
      "rationale": "",
      "source_note": ""
    },
    {
      "id": "revenue/licenses-and-permits",
      "label": "Licenses & Permits",
      "tier": 0,
      "parent": "",
      "constraint_tier": "",
      "role": "revenue_source",
      "derived": false,
      "rationale": "",
      "source_note": ""
    },
    {
      "id": "revenue/miscellaneous-revenue",
      "label": "Miscellaneous Revenue",
      "tier": 0,
      "parent": "",
      "constraint_tier": "",
      "role": "revenue_source",
      "derived": false,
      "rationale": "",
      "source_note": ""
    },
    {
      "id": "revenue/taxes/other",
      "label": "Other Taxes",
      "tier": 0,
      "parent": "",
      "constraint_tier": "",
      "role": "revenue_source",
      "derived": false,
      "rationale": "",
      "source_note": ""
    },
    {
      "id": "revenue/taxes/property",
      "label": "Property Taxes",
      "tier": 0,
      "parent": "",
      "constraint_tier": "",
      "role": "revenue_source",
      "derived": false,
      "rationale": "",
      "source_note": ""
    },
    {
      "id": "revenue/taxes/sales",
      "label": "Sales Taxes",
      "tier": 0,
      "parent": "",
      "constraint_tier": "",
      "role": "revenue_source",
      "derived": false,
      "rationale": "",
      "source_note": ""
    },
    {
      "id": "revenue/use-of-money-and-property",
      "label": "Use of Money And Property",
      "tier": 0,
      "parent": "",
      "constraint_tier": "",
      "role": "revenue_source",
      "derived": false,
      "rationale": "",
      "source_note": ""
    },
    {
      "id": "transfers/in",
      "label": "Transfers In",
      "tier": 0,
      "parent": "",
      "constraint_tier": "",
      "role": "transfer_in",
      "derived": false,
      "rationale": "",
      "source_note": ""
    },
    {
      "id": "fund-group/capital",
      "label": "Capital Funds",
      "tier": 2,
      "parent": "",
      "constraint_tier": "",
      "role": "fund_group",
      "derived": false,
      "rationale": "",
      "source_note": ""
    },
    {
      "id": "fund-group/debt-service",
      "label": "Debt Service Funds",
      "tier": 2,
      "parent": "",
      "constraint_tier": "",
      "role": "fund_group",
      "derived": false,
      "rationale": "",
      "source_note": ""
    },
    {
      "id": "fund-group/enterprise",
      "label": "Enterprise Funds",
      "tier": 2,
      "parent": "",
      "constraint_tier": "",
      "role": "fund_group",
      "derived": false,
      "rationale": "",
      "source_note": ""
    },
    {
      "id": "fund-group/general",
      "label": "General Fund",
      "tier": 2,
      "parent": "",
      "constraint_tier": "",
      "role": "fund_group",
      "derived": false,
      "rationale": "",
      "source_note": ""
    },
    {
      "id": "fund-group/internal-service",
      "label": "Internal Service Funds",
      "tier": 2,
      "parent": "",
      "constraint_tier": "",
      "role": "fund_group",
      "derived": false,
      "rationale": "",
      "source_note": ""
    },
    {
      "id": "fund-group/special-revenue",
      "label": "Special Revenue Funds",
      "tier": 2,
      "parent": "",
      "constraint_tier": "",
      "role": "fund_group",
      "derived": false,
      "rationale": "",
      "source_note": ""
    },
    {
      "id": "expenditure/capital-outlay",
      "label": "Capital Outlay",
      "tier": 5,
      "parent": "",
      "constraint_tier": "",
      "role": "object_category",
      "derived": false,
      "rationale": "",
      "source_note": ""
    },
    {
      "id": "expenditure/debt-services",
      "label": "Debt Services",
      "tier": 5,
      "parent": "",
      "constraint_tier": "",
      "role": "object_category",
      "derived": false,
      "rationale": "",
      "source_note": ""
    },
    {
      "id": "expenditure/services-and-supplies",
      "label": "Services & Supplies",
      "tier": 5,
      "parent": "",
      "constraint_tier": "",
      "role": "object_category",
      "derived": false,
      "rationale": "",
      "source_note": ""
    },
    {
      "id": "expenditure/wages-and-benefits",
      "label": "Wages & Benefits",
      "tier": 5,
      "parent": "",
      "constraint_tier": "",
      "role": "object_category",
      "derived": false,
      "rationale": "",
      "source_note": ""
    },
    {
      "id": "fund-balance/contribution",
      "label": "Fund Balance Contribution",
      "tier": 5,
      "parent": "",
      "constraint_tier": "",
      "role": "fund_balance_contribution",
      "derived": true,
      "rationale": "Our sign-decomposition of a published change in balance: a positive change is a contribution to accumulated balance.",
      "source_note": "Budget Book PDF pp.66-67, CHANGE IN WORKING CAPITAL; pp.186-209, each fund's beginning and ending balance"
    },
    {
      "id": "fund-balance/reserve-increase",
      "label": "Addition to Reserves",
      "tier": 5,
      "parent": "",
      "constraint_tier": "",
      "role": "reserve_increase",
      "derived": false,